{"cases":[{"authored_for_tool":false,"case_id":"organic-case-001","customer_authorization_ref":"authorization:replace-me","expected_platform":"DB2","procedure_role_hint":null,"source_must_remain_unmodified":true,"source_origin":"ORGANIC_CUSTOMER_SOURCE","source_path":"C:/customer/approved-source-root/procedure.sql"}],"content_digest":"sha256:98d4def0d359016ca09ac6e7b92a2bae1585d89ff953093703efafb9b80ed21a","custody_agreement_digest":"sha256:replace-me","custody_agreement_id":"custody-replace-me","customer_ref":"customer:replace-me","estate_ref":"estate:replace-me","schema_version":"organic-validation-manifest-1.0","validation_id":"validation-replace-me","validation_level":"ORGANIC_SMOKE"}
